{
  "schema_version": 1,
  "core_documents": [
    "core/operating-model.md",
    "SOUL.md"
  ],
  "packs": {
    "persona.indy": {
      "extensions": [],
      "managed_files": []
    },
    "universal.authoring": {
      "extensions": [],
      "managed_files": [
        {
          "source": "standards/code.md",
          "target": "standards/code.md"
        },
        {
          "source": "standards/tests.md",
          "target": "standards/tests.md"
        },
        {
          "source": "standards/pr.md",
          "target": "standards/pr.md"
        },
        {
          "source": "standards/domains/architecture.md",
          "target": "standards/domains/architecture.md"
        },
        {
          "source": "standards/domains/logging.md",
          "target": "standards/domains/logging.md"
        }
      ]
    },
    "language.typescript": {
      "extensions": [
        ".ts",
        ".tsx"
      ],
      "managed_files": [
        {
          "source": "standards/languages/typescript.md",
          "target": "standards/languages/typescript.md"
        }
      ]
    },
    "language.javascript": {
      "extensions": [
        ".js",
        ".jsx"
      ],
      "managed_files": [
        {
          "source": "standards/languages/typescript.md",
          "target": "standards/languages/typescript.md"
        }
      ]
    },
    "language.rust": {
      "extensions": [
        ".rs"
      ],
      "managed_files": [
        {
          "source": "standards/languages/rust.md",
          "target": "standards/languages/rust.md"
        }
      ]
    },
    "language.go": {
      "extensions": [
        ".go"
      ],
      "managed_files": [
        {
          "source": "standards/languages/go.md",
          "target": "standards/languages/go.md"
        }
      ]
    },
    "language.python": {
      "extensions": [
        ".py"
      ],
      "managed_files": [
        {
          "source": "standards/languages/python.md",
          "target": "standards/languages/python.md"
        }
      ]
    },
    "language.shell": {
      "extensions": [
        ".sh"
      ],
      "managed_files": [
        {
          "source": "standards/languages/shell.md",
          "target": "standards/languages/shell.md"
        }
      ]
    },
    "language.mdx": {
      "extensions": [
        ".mdx"
      ],
      "managed_files": [
        {
          "source": "standards/languages/mdx.md",
          "target": "standards/languages/mdx.md"
        }
      ]
    },
    "domain.sql": {
      "extensions": [
        ".sql"
      ],
      "managed_files": [
        {
          "source": "standards/domains/sql.md",
          "target": "standards/domains/sql.md"
        }
      ]
    },
    "domain.http": {
      "extensions": [],
      "managed_files": [
        {
          "source": "standards/domains/http.md",
          "target": "standards/domains/http.md"
        },
        {
          "source": "standards/domains/http-responses.md",
          "target": "standards/domains/http-responses.md"
        },
        {
          "source": "standards/domains/http-surface.md",
          "target": "standards/domains/http-surface.md"
        }
      ]
    },
    "domain.auth": {
      "extensions": [],
      "managed_files": [
        {
          "source": "standards/domains/auth.md",
          "target": "standards/domains/auth.md"
        }
      ]
    },
    "domain.documentation": {
      "extensions": [],
      "managed_files": [
        {
          "source": "standards/docs.md",
          "target": "standards/docs.md"
        },
        {
          "source": "standards/docs-pages.md",
          "target": "standards/docs-pages.md"
        }
      ]
    },
    "domain.changelog": {
      "extensions": [],
      "managed_files": [
        {
          "source": "standards/changelog.md",
          "target": "standards/changelog.md"
        }
      ]
    },
    "workflow.specifications": {
      "extensions": [],
      "managed_files": [
        {
          "source": "standards/spec.md",
          "target": "standards/spec.md"
        },
        {
          "source": "standards/spec-template.md",
          "target": "standards/spec-template.md"
        }
      ]
    },
    "workflow.governance": {
      "extensions": [],
      "managed_files": [
        {
          "source": "docs/ORLY_ARCHITECTURE.md",
          "target": "docs/ORLY_ARCHITECTURE.md"
        }
      ]
    },
    "product.agentsfleet": {
      "extensions": [],
      "managed_files": []
    },
    "workflow.skills": {
      "extensions": [],
      "managed_files": [
        {
          "source": "skills/orly-spec/SKILL.md",
          "target": ".claude/skills/orly-spec/SKILL.md"
        },
        {
          "source": "skills/orly-spec/SKILL.md",
          "target": ".agents/skills/orly-spec/SKILL.md"
        },
        {
          "source": "skills/orly-spec/SKILL.md",
          "target": ".opencode/skills/orly-spec/SKILL.md"
        },
        {
          "source": "skills/orly-build/SKILL.md",
          "target": ".claude/skills/orly-build/SKILL.md"
        },
        {
          "source": "skills/orly-build/SKILL.md",
          "target": ".agents/skills/orly-build/SKILL.md"
        },
        {
          "source": "skills/orly-build/SKILL.md",
          "target": ".opencode/skills/orly-build/SKILL.md"
        },
        {
          "source": "skills/orly-ship/SKILL.md",
          "target": ".claude/skills/orly-ship/SKILL.md"
        },
        {
          "source": "skills/orly-ship/SKILL.md",
          "target": ".agents/skills/orly-ship/SKILL.md"
        },
        {
          "source": "skills/orly-ship/SKILL.md",
          "target": ".opencode/skills/orly-ship/SKILL.md"
        },
        {
          "source": "agents/orly-standards-reviewer.md",
          "target": ".claude/agents/orly-standards-reviewer.md"
        }
      ]
    }
  },
  "rules": [
    {
      "key": "governance.registry.valid",
      "state": "active",
      "decision": "mechanical",
      "pack": "workflow.governance",
      "checker": [
        "bin/orly",
        "verify"
      ],
      "fixtures": {
        "pass": [
          "fixtures/registry-valid.json"
        ],
        "fail": [
          "fixtures/registry-invalid.json"
        ]
      }
    },
    {
      "key": "governance.render.stable",
      "state": "active",
      "decision": "mechanical",
      "pack": "workflow.governance",
      "checker": [
        "bin/orly",
        "verify"
      ],
      "fixtures": {
        "pass": [
          "src/render.test.ts"
        ],
        "fail": [
          "fixtures/unclosed-pack-block.md"
        ]
      }
    },
    {
      "key": "repository.conform",
      "state": "active",
      "decision": "repository",
      "pack": "universal.authoring",
      "command": "conform"
    }
  ],
  "helpers": {
    "gstack": {
      "source": "https://github.com/garrytan/gstack",
      "version": "1.91.271.0",
      "commit": "584e9c15352de1f1c42d237dd3c268d6284bfdee"
    },
    "egm": {
      "source": "https://github.com/google/elephant-goldfish-model",
      "commit": "a8380ab5f0aba392c97e31c79f9a6666b3f09f14"
    }
  }
}
